{"schema_version":2,"id":"skill-excel-generate","name":"excel-generate","version":"0.1.0","source":{"type":"builtin","uri":"first-party:skill-excel-generate","revision":"shipped-v1"},"compatibility":{"deskpet":">=0.5.0","os":["windows","linux","macos"],"architectures":["x86_64","aarch64"],"python":">=3.11"},"entries":{"skills":[{"id":"excel-generate","path":"skills/excel-generate/SKILL.md","allowed_tools":["excel_create"]}]},"permissions":[],"effects":["read_only"],"dependencies":{"python":[],"commands":[]},"files":[{"path":"skills/excel-generate/SKILL.md","sha256":"e48681682e28ece259abec1b0d8b2166cf3c545eb6020ef8f16056bc5ddeffd4"}],"uninstall":{"stop_servers":false,"remove_environment_when_unreferenced":false}}
