{"schema_version":2,"id":"skill-verify-deskpet","name":"verify-deskpet","version":"0.1.0","source":{"type":"builtin","uri":"first-party:skill-verify-deskpet","revision":"shipped-v1"},"compatibility":{"deskpet":">=0.5.0","os":["windows","linux","macos"],"architectures":["x86_64","aarch64"],"python":">=3.11"},"entries":{"skills":[{"id":"verify-deskpet","path":"skills/verify-deskpet/SKILL.md","allowed_tools":[]}]},"permissions":[],"effects":["read_only"],"dependencies":{"python":[],"commands":[]},"files":[{"path":"skills/verify-deskpet/SKILL.md","sha256":"db0ab801f184d6f5c9bf6211470dcfdfcca29bc2138201d5dc6ac477d0fb9b88"}],"uninstall":{"stop_servers":false,"remove_environment_when_unreferenced":false}}
