{"schema_version":2,"id":"skill-pdf-export","name":"pdf-export","version":"0.1.0","source":{"type":"builtin","uri":"first-party:skill-pdf-export","revision":"shipped-v1"},"compatibility":{"deskpet":">=0.5.0","os":["windows","linux","macos"],"architectures":["x86_64","aarch64"],"python":">=3.11"},"entries":{"skills":[{"id":"pdf-export","path":"skills/pdf-export/SKILL.md","allowed_tools":["office_pick_file","pdf_export"]}]},"permissions":[],"effects":["read_only"],"dependencies":{"python":[],"commands":[]},"files":[{"path":"skills/pdf-export/SKILL.md","sha256":"171f7dfb67bcd14667812f60a04c115d06f4dfbfe5fae3b4b47c5bd151e9c310"}],"uninstall":{"stop_servers":false,"remove_environment_when_unreferenced":false}}
