{"schema_version":2,"id":"skill-deep-research","name":"deep-research","version":"0.4.1","source":{"type":"builtin","uri":"first-party:skill-deep-research","revision":"shipped-v1"},"compatibility":{"deskpet":">=0.5.0","os":["windows","linux","macos"],"architectures":["x86_64","aarch64"],"python":">=3.11"},"entries":{"skills":[{"id":"deep-research","path":"skills/deep-research/SKILL.md","allowed_tools":["deepresearch","doc_create","ppt_create","web_search"]}]},"permissions":[],"effects":["read_only"],"dependencies":{"python":[],"commands":[]},"files":[{"path":"skills/deep-research/SKILL.md","sha256":"f8d66c4075cd0e280a9ae3f606dd4608072a32fedd0fb6e4b49df3865fc87a2e"}],"uninstall":{"stop_servers":false,"remove_environment_when_unreferenced":false}}
