{"schema_version":2,"id":"skill-run-deskpet","name":"run-deskpet","version":"0.1.0","source":{"type":"builtin","uri":"first-party:skill-run-deskpet","revision":"shipped-v1"},"compatibility":{"deskpet":">=0.5.0","os":["windows","linux","macos"],"architectures":["x86_64","aarch64"],"python":">=3.11"},"entries":{"skills":[{"id":"run-deskpet","path":"skills/run-deskpet/SKILL.md","allowed_tools":[]}]},"permissions":[],"effects":["read_only"],"dependencies":{"python":[],"commands":[]},"files":[{"path":"skills/run-deskpet/SKILL.md","sha256":"2a789ff646f189421bdae03b88e53de0ef4fe257f433e811b27cccb471162b2e"}],"uninstall":{"stop_servers":false,"remove_environment_when_unreferenced":false}}
